{
    "client": {
      "first_name": "aaa",
      "last_name": "bbb",
      "address": {
        "address_line_one": "14 Real Street",
        "address_line_two": "Sometown",
        "county": "Hampshire",
        "postcode": "AB1 2CD"
      }
    },
    "partner": {
      "first_name": "ccc",
      "last_name": "bbb",
      "address": {
        "address_line_one": "14 Real Street",
        "address_line_two": "Sometown",
        "county": "Hampshire",
        "postcode": "AB1 2CD"
      }
    },
    "partner_role_in_case": "none",
    "partner_conflict_of_interest": false
}
